{
  "$schema": "../schemas/agent-instantiation-proposal.schema.json",
  "schema_version": "1.0.0",
  "environment_genesis": {
    "canonical_release": {"tag": "communications-v0.6.0", "tag_object": "500d084b11d5b979a05c583e5ce401683e4f0aa0", "tag_target": "9a545b4f96d6cce713e9ab1d8e46aea65b387ac7"}
  },
  "destination_environment_id": "example-sovereign-environment",
  "new_agent_id": "fixture-wtb-researcher-001",
  "parent_agent": {"agent_id": "fixture-parent-001"},
  "family": {
    "owner": "normsexchange-dev",
    "repository": "normsexchange-dev/nx-agent-blueprints_dev",
    "tag": "blueprints-v0.1.1",
    "tag_object": "0000000000000000000000000000000000000000",
    "tag_target": "0000000000000000000000000000000000000000",
    "package_digest": "0000000000000000000000000000000000000000000000000000000000000000"
  },
  "specializations": [],
  "creation_time": "2026-08-28T00:00:00Z",
  "runtime_adapter": "neutral",
  "activate": false
}
